{
  "$schema": "https://saaj-ui.vercel.app/schema/registry-item.json",
  "name": "card",
  "type": "registry:ui",
  "registryDependencies": [
    "text"
  ],
  "files": [
    {
      "path": "src/registry/ui/card.tsx",
      "content": "import { View, ViewProps } from 'react-native';\nimport { createContext, useContext, useMemo } from 'react';\nimport { StyleSheet } from 'react-native-unistyles';\n\nimport { Text, TextProps } from '@/registry/ui/text';\n\ntype CardVariants = {\n  variant?: 'soft' | 'outline' | 'ghost';\n  size?: 'sm' | 'md';\n};\n\ntype CardContextType = Required<CardVariants>;\n\nconst CardContext = createContext<CardContextType | null>(null);\n\nfunction useCard() {\n  const ctx = useContext(CardContext);\n  if (!ctx) {\n    throw new Error('useCard must be used within a <Card />');\n  }\n  return ctx;\n}\n\ntype CardProps = ViewProps & CardVariants;\n\nfunction Card({ variant = 'soft', size = 'md', style, ...props }: CardProps) {\n  styles.useVariants({\n    variant,\n    size,\n  });\n\n  const contextValue = useMemo<CardContextType>(\n    () => ({ variant, size }),\n    [variant, size],\n  );\n\n  return (\n    <CardContext value={contextValue}>\n      <View style={[styles.card, style]} {...props} />\n    </CardContext>\n  );\n}\n\nfunction CardHeader({ style, ...props }: ViewProps) {\n  const { variant, size } = useCard();\n\n  styles.useVariants({\n    variant,\n    size,\n  });\n\n  return <View style={[styles.cardHeader, style]} {...props} />;\n}\n\nCard.Header = CardHeader;\n\nfunction CardTitle(props: TextProps) {\n  const { size } = useCard();\n  return <Text variant={size === 'sm' ? 'labelLg' : 'headlineXs'} {...props} />;\n}\n\nCard.Title = CardTitle;\n\nfunction CardDescription(props: TextProps) {\n  const { size } = useCard();\n\n  return (\n    <Text\n      variant={size === 'sm' ? 'bodySm' : 'bodyMd'}\n      color=\"mutedForeground\"\n      {...props}\n    />\n  );\n}\n\nCard.Description = CardDescription;\n\nfunction CardContent({ style, ...props }: ViewProps) {\n  const { variant, size } = useCard();\n\n  styles.useVariants({\n    variant,\n    size,\n  });\n\n  return <View style={[styles.cardContent, style]} {...props} />;\n}\n\nCard.Content = CardContent;\n\nfunction CardFooter({ style, ...props }: ViewProps) {\n  const { variant, size } = useCard();\n\n  styles.useVariants({\n    variant,\n    size,\n  });\n\n  return <View style={[styles.cardFooter, style]} {...props} />;\n}\n\nCard.Footer = CardFooter;\n\nconst styles = StyleSheet.create(({ colors, radius, space }) => ({\n  card: {\n    position: 'relative',\n    borderCurve: 'continuous',\n    overflow: 'hidden',\n    variants: {\n      variant: {\n        soft: {\n          backgroundColor: colors.card,\n        },\n        outline: {\n          borderWidth: 1,\n          borderColor: colors.borderSubtle,\n        },\n        ghost: {\n          backgroundColor: colors.transparent,\n        },\n      },\n      size: {\n        sm: {\n          borderRadius: radius.md,\n          padding: space.xl,\n          gap: space.lg,\n        },\n        md: {\n          borderRadius: radius.lg,\n          padding: space['2xl'],\n          gap: space.xl,\n        },\n      },\n    },\n  },\n  cardHeader: {\n    variants: {\n      size: {\n        sm: {\n          gap: space.sm,\n        },\n        md: {\n          gap: space.md,\n        },\n      },\n    },\n  },\n  cardContent: {\n    variants: {\n      size: {\n        sm: {\n          gap: space.md,\n        },\n        md: {\n          gap: space.lg,\n        },\n      },\n    },\n  },\n  cardFooter: {\n    variants: {\n      size: {\n        sm: {\n          gap: space.md,\n        },\n        md: {\n          gap: space.lg,\n        },\n      },\n    },\n  },\n}));\n\nexport { Card, useCard };\nexport type { CardProps };\n",
      "type": "registry:ui"
    }
  ]
}