{
  "$schema": "https://saaj-ui.vercel.app/schema/registry-item.json",
  "name": "avatar",
  "type": "registry:ui",
  "registryDependencies": [
    "icon",
    "text"
  ],
  "files": [
    {
      "path": "src/registry/ui/avatar.tsx",
      "content": "import React, {\n  createContext,\n  useCallback,\n  useContext,\n  useEffect,\n  useLayoutEffect,\n  useMemo,\n  useState,\n} from 'react';\nimport { Image, ImageErrorEvent, ImageLoadEvent, View } from 'react-native';\nimport { StyleSheet } from 'react-native-unistyles';\n\nimport { Icon, IconProps } from '@/registry/ui/icon';\nimport { Text, TextProps } from '@/registry/ui/text';\n\ntype AvatarSize = 'xs' | 'sm' | 'md' | 'lg';\ntype ImageLoadingStatus = 'idle' | 'loading' | 'loaded' | 'error';\n\ntype AvatarContextType = {\n  size: AvatarSize;\n  imageLoadingStatus: ImageLoadingStatus;\n  setImageLoadingStatus: (status: ImageLoadingStatus) => void;\n};\n\nconst AvatarContext = createContext<AvatarContextType | null>(null);\n\nconst useAvatar = () => {\n  const ctx = useContext(AvatarContext);\n  if (!ctx) {\n    throw new Error('useAvatar must be used within a <Avatar />');\n  }\n  return ctx;\n};\n\ntype AvatarProps = React.ComponentPropsWithRef<typeof View> & {\n  size?: AvatarSize;\n};\n\nfunction Avatar({ size = 'md', style, ...restProps }: AvatarProps) {\n  const [imageLoadingStatus, setImageLoadingStatus] =\n    useState<ImageLoadingStatus>('idle');\n\n  styles.useVariants({\n    size,\n  });\n\n  const contextValue = useMemo<AvatarContextType>(\n    () => ({\n      size,\n      imageLoadingStatus,\n      setImageLoadingStatus,\n    }),\n    [size, imageLoadingStatus, setImageLoadingStatus],\n  );\n\n  return (\n    <AvatarContext value={contextValue}>\n      <View style={[styles.container, style]} {...restProps} />\n    </AvatarContext>\n  );\n}\n\ntype AvatarImageProps = React.ComponentPropsWithRef<typeof Image>;\n\nfunction AvatarImage({\n  onLoad: onLoadProp,\n  onError: onErrorProp,\n  style,\n  ...restProps\n}: AvatarImageProps) {\n  const { size, setImageLoadingStatus } = useAvatar();\n\n  styles.useVariants({\n    size,\n  });\n\n  useLayoutEffect(() => {\n    setImageLoadingStatus('loading');\n\n    return () => {\n      setImageLoadingStatus('idle');\n    };\n  }, [setImageLoadingStatus]);\n\n  const onLoad = useCallback(\n    (e: ImageLoadEvent) => {\n      setImageLoadingStatus('loaded');\n      onLoadProp?.(e);\n    },\n    [onLoadProp, setImageLoadingStatus],\n  );\n\n  const onError = useCallback(\n    (e: ImageErrorEvent) => {\n      setImageLoadingStatus('error');\n      onErrorProp?.(e);\n    },\n    [onErrorProp, setImageLoadingStatus],\n  );\n\n  return (\n    <Image\n      onLoad={onLoad}\n      onError={onError}\n      style={[styles.container, style]}\n      {...restProps}\n    />\n  );\n}\n\nAvatar.Image = AvatarImage;\n\ntype AvatarFallbackProps = React.ComponentPropsWithRef<typeof View> & {\n  delayMs?: number;\n};\n\nfunction AvatarFallback({ delayMs, style, ...restProps }: AvatarFallbackProps) {\n  const { size, imageLoadingStatus } = useAvatar();\n\n  styles.useVariants({\n    size,\n  });\n\n  const [canRender, setCanRender] = useState(delayMs === undefined);\n\n  useEffect(() => {\n    let timerId: ReturnType<typeof setTimeout>;\n\n    if (delayMs !== undefined) {\n      timerId = setTimeout(() => setCanRender(true), delayMs);\n    }\n\n    return () => clearTimeout(timerId);\n  }, [delayMs]);\n\n  return canRender && imageLoadingStatus !== 'loaded' ? (\n    <View style={[styles.container, styles.fallback, style]} {...restProps} />\n  ) : null;\n}\n\nAvatar.Fallback = AvatarFallback;\n\nconst textVariantMap: Record<AvatarSize, NonNullable<TextProps['variant']>> = {\n  xs: 'labelXs',\n  sm: 'labelSm',\n  md: 'labelMd',\n  lg: 'labelLg',\n};\n\nfunction AvatarText(props: TextProps) {\n  const { size } = useAvatar();\n\n  return <Text color=\"foreground\" variant={textVariantMap[size]} {...props} />;\n}\n\nAvatar.Text = AvatarText;\n\nconst iconSizeMap: Record<AvatarSize, NonNullable<IconProps['size']>> = {\n  xs: 14,\n  sm: 16,\n  md: 20,\n  lg: 24,\n};\n\nfunction AvatarIcon(props: IconProps) {\n  const { size } = useAvatar();\n\n  return <Icon color=\"foreground\" size={iconSizeMap[size]} {...props} />;\n}\n\nAvatar.Icon = AvatarIcon;\n\nconst styles = StyleSheet.create(({ colors, radius }) => ({\n  container: {\n    position: 'relative',\n    borderRadius: radius.full,\n    borderCurve: 'continuous',\n    overflow: 'hidden',\n    variants: {\n      size: {\n        xs: {\n          width: 28,\n          height: 28,\n        },\n        sm: {\n          width: 36,\n          height: 36,\n        },\n        md: {\n          width: 48,\n          height: 48,\n        },\n        lg: {\n          width: 56,\n          height: 56,\n        },\n      },\n    },\n  },\n  fallback: {\n    position: 'absolute',\n    justifyContent: 'center',\n    alignItems: 'center',\n    backgroundColor: colors.muted,\n  },\n}));\n\nexport { Avatar, useAvatar };\nexport type { AvatarProps };\n",
      "type": "registry:ui"
    }
  ]
}