{
  "$schema": "https://saaj-ui.vercel.app/schema/registry-item.json",
  "name": "collapsible",
  "type": "registry:ui",
  "registryDependencies": [
    "use-controllable-state"
  ],
  "files": [
    {
      "path": "src/registry/ui/collapsible.tsx",
      "content": "import React, { createContext, useCallback, useContext, useMemo } from 'react';\nimport {\n  GestureResponderEvent,\n  LayoutChangeEvent,\n  Pressable,\n  PressableProps,\n  View,\n  ViewProps,\n} from 'react-native';\nimport Animated, {\n  Easing,\n  Keyframe,\n  useAnimatedStyle,\n  useSharedValue,\n  withTiming,\n  WithTimingConfig,\n} from 'react-native-reanimated';\n\nimport { useControllableState } from '@/registry/hooks/use-controllable-state';\n\nconst animConfig: WithTimingConfig = {\n  duration: 200,\n  easing: Easing.inOut(Easing.ease),\n};\n\ntype CollapsibleContextType = {\n  open: boolean;\n  onOpenChange: (open: boolean) => void;\n  disabled: boolean;\n};\n\nconst CollapsibleContext = createContext<CollapsibleContextType | null>(null);\n\nconst useCollapsible = () => {\n  const ctx = useContext(CollapsibleContext);\n  if (!ctx) {\n    throw new Error('useCollapsible must be used within a <Collapsible />');\n  }\n  return ctx;\n};\n\ntype CollapsibleProps = {\n  children?: React.ReactNode;\n  defaultOpen?: boolean;\n  open?: boolean;\n  onOpenChange?: (open: boolean) => void;\n  disabled?: boolean;\n};\n\nfunction Collapsible({\n  children,\n  defaultOpen,\n  open: openProp,\n  onOpenChange: onOpenChangeProp,\n  disabled = false,\n}: CollapsibleProps) {\n  const [open, setOpen] = useControllableState({\n    defaultValue: defaultOpen ?? false,\n    controlledValue: openProp,\n    onControlledChange: onOpenChangeProp,\n  });\n\n  const contextValue = useMemo<CollapsibleContextType>(\n    () => ({\n      open,\n      onOpenChange: setOpen,\n      disabled,\n    }),\n    [open, setOpen, disabled],\n  );\n\n  return (\n    <CollapsibleContext value={contextValue}>{children}</CollapsibleContext>\n  );\n}\n\ntype CollapsibleStateProps = {\n  children?:\n    | React.ReactNode\n    | ((ctx: CollapsibleContextType) => React.ReactNode);\n};\n\nfunction CollapsibleState({ children }: CollapsibleStateProps) {\n  const ctx = useCollapsible();\n  if (typeof children === 'function') {\n    return children(ctx);\n  }\n  return children;\n}\n\nCollapsible.State = CollapsibleState;\n\ntype CollapsibleTriggerProps<T extends React.ElementType = typeof Pressable> =\n  React.ComponentPropsWithoutRef<T> & {\n    as?: T;\n    ref?: React.Ref<View>;\n  };\n\nfunction CollapsibleTrigger<T extends React.ElementType<PressableProps>>({\n  as,\n  accessibilityState,\n  disabled: disabledProp,\n  onPress: onPressProp,\n  ...restProps\n}: CollapsibleTriggerProps<T>) {\n  const { open, onOpenChange, disabled: rootDisabled } = useCollapsible();\n\n  const disabled = rootDisabled ?? disabledProp;\n\n  const onPress = useCallback(\n    (e: GestureResponderEvent) => {\n      onOpenChange(!open);\n      onPressProp?.(e);\n    },\n    [onOpenChange, open, onPressProp],\n  );\n\n  const Comp = as ?? Pressable;\n\n  return (\n    <Comp\n      accessibilityRole=\"button\"\n      accessibilityState={{\n        ...accessibilityState,\n        expanded: open,\n        disabled,\n      }}\n      disabled={disabled}\n      onPress={onPress}\n      {...restProps}\n    />\n  );\n}\n\nCollapsible.Trigger = CollapsibleTrigger;\n\nconst exitAnim = new Keyframe({\n  0: {\n    opacity: 1,\n  },\n  100: {\n    opacity: 1,\n    easing: animConfig.easing,\n  },\n});\n\ntype CollapsibleContentProps = React.ComponentPropsWithRef<typeof View>;\n\nfunction CollapsibleContent(props: CollapsibleContentProps) {\n  const { open } = useCollapsible();\n\n  const height = useSharedValue(0);\n\n  const animatedStyles = useAnimatedStyle(() => {\n    return {\n      width: '100%',\n      alignItems: 'center',\n      height: withTiming(open ? height.value : 0, animConfig),\n      overflow: 'hidden',\n    };\n  });\n\n  const containerStyles: ViewProps['style'] = {\n    position: 'absolute',\n  };\n\n  const onLayout = useCallback(\n    (e: LayoutChangeEvent) => {\n      height.value = e.nativeEvent.layout.height;\n    },\n    [height],\n  );\n\n  return (\n    <Animated.View style={animatedStyles}>\n      {open && (\n        <Animated.View\n          style={containerStyles}\n          exiting={exitAnim.duration(animConfig.duration ?? 200)}\n        >\n          <View onLayout={onLayout} {...props} />\n        </Animated.View>\n      )}\n    </Animated.View>\n  );\n}\n\nCollapsible.Content = CollapsibleContent;\n\nexport { Collapsible, useCollapsible };\nexport type { CollapsibleProps };\n",
      "type": "registry:ui"
    }
  ]
}