{
  "$schema": "https://saaj-ui.vercel.app/schema/registry-item.json",
  "name": "switch",
  "type": "registry:ui",
  "registryDependencies": [
    "use-controllable-state"
  ],
  "files": [
    {
      "path": "src/registry/ui/switch.tsx",
      "content": "import React, { createContext, useCallback, useContext, useMemo } from 'react';\nimport {\n  GestureResponderEvent,\n  Pressable,\n  PressableStateCallbackType,\n  StyleProp,\n  ViewStyle,\n} from 'react-native';\nimport { StyleSheet } from 'react-native-unistyles';\nimport { useAnimatedTheme } from 'react-native-unistyles/reanimated';\nimport Animated, {\n  Easing,\n  SharedValue,\n  useAnimatedStyle,\n  useSharedValue,\n  withTiming,\n} from 'react-native-reanimated';\n\nimport { useControllableState } from '@/registry/hooks/use-controllable-state';\n\ntype SwitchContextType = {\n  checked: boolean;\n  onCheckedChange: (checked: boolean) => void;\n  disabled: boolean;\n  pressed: SharedValue<boolean>;\n};\n\nconst SwitchContext = createContext<SwitchContextType | null>(null);\n\nconst useSwitch = () => {\n  const ctx = useContext(SwitchContext);\n  if (!ctx) {\n    throw new Error('useSwitch must be used within a <Switch />');\n  }\n  return ctx;\n};\n\ntype SwitchProps = Omit<\n  React.ComponentPropsWithRef<typeof Pressable>,\n  'style'\n> & {\n  defaultChecked?: boolean;\n  checked?: boolean;\n  onCheckedChange?: (checked: boolean) => void;\n  style?:\n    | StyleProp<ViewStyle>\n    | ((\n        state: PressableStateCallbackType,\n        context: SwitchContextType,\n      ) => StyleProp<ViewStyle>);\n};\n\nfunction Switch({\n  accessibilityState,\n  children,\n  defaultChecked,\n  checked: checkedProp,\n  onCheckedChange: onCheckedChangeProp,\n  disabled = false,\n  onPress: onPressProp,\n  onPressIn: onPressInProp,\n  onPressOut: onPressOutProp,\n  style,\n  ...restProps\n}: SwitchProps) {\n  const [checked, onCheckedChange] = useControllableState({\n    defaultValue: defaultChecked ?? false,\n    controlledValue: checkedProp,\n    onControlledChange: onCheckedChangeProp,\n  });\n\n  const pressed = useSharedValue(false);\n\n  const onPress = useCallback(\n    (e: GestureResponderEvent) => {\n      onCheckedChange(value => !value);\n      onPressProp?.(e);\n    },\n    [onPressProp, onCheckedChange],\n  );\n\n  const onPressIn = useCallback(\n    (e: GestureResponderEvent) => {\n      pressed.value = true;\n      onPressInProp?.(e);\n    },\n    [pressed, onPressInProp],\n  );\n\n  const onPressOut = useCallback(\n    (e: GestureResponderEvent) => {\n      pressed.value = false;\n      onPressOutProp?.(e);\n    },\n    [pressed, onPressOutProp],\n  );\n\n  const contextValue = useMemo<SwitchContextType>(\n    () => ({\n      checked,\n      onCheckedChange,\n      disabled: !!disabled,\n      pressed,\n    }),\n    [checked, onCheckedChange, disabled, pressed],\n  );\n\n  return (\n    <SwitchContext value={contextValue}>\n      <Pressable\n        accessibilityRole=\"switch\"\n        accessibilityState={{\n          ...accessibilityState,\n          checked: checked,\n          disabled: !!disabled,\n        }}\n        disabled={disabled}\n        onPress={onPress}\n        onPressIn={onPressIn}\n        onPressOut={onPressOut}\n        style={state => [\n          typeof style === 'function' ? style(state, contextValue) : style,\n        ]}\n        {...restProps}\n      >\n        {children ?? <SwitchIndicator />}\n      </Pressable>\n    </SwitchContext>\n  );\n}\n\ntype SwitchStateProps = {\n  children?: React.ReactNode | ((ctx: SwitchContextType) => React.ReactNode);\n};\n\nfunction SwitchState({ children }: SwitchStateProps) {\n  const ctx = useSwitch();\n  if (typeof children === 'function') {\n    return children(ctx);\n  }\n  return children;\n}\n\nSwitch.State = SwitchState;\n\nconst animConfig = {\n  duration: 200,\n  easing: Easing.out(Easing.ease),\n} as const;\n\nconst GAP = 2.5; // gap between track and thumb\nconst TRACK_HEIGHT = 28;\nconst TRACK_WIDTH = TRACK_HEIGHT * 1.75;\nconst THUMB_HEIGHT = TRACK_HEIGHT - GAP * 2;\nconst THUMB_WIDTH = THUMB_HEIGHT;\nconst PRESSED_THUMB_WIDTH = THUMB_WIDTH * 1.15;\n\ntype SwitchIndicatorProps = React.ComponentPropsWithRef<typeof Animated.View>;\n\nfunction SwitchIndicator({ style, ...restProps }: SwitchIndicatorProps) {\n  const { checked, disabled, pressed } = useSwitch();\n\n  const theme = useAnimatedTheme();\n\n  const trackAnimatedStyles = useAnimatedStyle(() => {\n    return {\n      opacity: withTiming(disabled ? 0.5 : 1, animConfig),\n      height: TRACK_HEIGHT,\n      width: TRACK_WIDTH,\n      backgroundColor: withTiming(\n        checked ? theme.value.colors.primary : theme.value.colors.switch,\n        animConfig,\n      ),\n      boxShadow: `inset 0px 2px 4px 0px rgba(0, 0, 0, 0.05)`,\n      overflow: 'hidden',\n    };\n  });\n\n  const thumbAnimatedStyle = useAnimatedStyle(() => {\n    return {\n      height: THUMB_HEIGHT,\n      width: withTiming(\n        pressed.value ? PRESSED_THUMB_WIDTH : THUMB_WIDTH,\n        animConfig,\n      ),\n      top: GAP,\n      left: withTiming(\n        checked\n          ? pressed.value\n            ? TRACK_WIDTH - GAP - PRESSED_THUMB_WIDTH\n            : TRACK_WIDTH - GAP - THUMB_WIDTH\n          : GAP,\n        animConfig,\n      ),\n      backgroundColor: withTiming(\n        checked\n          ? theme.value.colors.primaryForeground\n          : theme.value.colors.white,\n        animConfig,\n      ),\n      boxShadow: `0px 2px 8px 0px rgba(0, 0, 0, 0.1)`,\n    };\n  });\n\n  return (\n    <Animated.View\n      style={[styles.radius, trackAnimatedStyles, style]}\n      {...restProps}\n    >\n      <Animated.View style={[styles.radius, thumbAnimatedStyle]} />\n    </Animated.View>\n  );\n}\n\nSwitch.Indicator = SwitchIndicator;\n\nconst styles = StyleSheet.create(({ radius }) => ({\n  radius: {\n    borderRadius: radius.full,\n    borderCurve: 'continuous',\n  },\n}));\n\nexport { Switch, useSwitch };\nexport type { SwitchProps };\n",
      "type": "registry:ui"
    }
  ]
}