{
  "$schema": "https://saaj-ui.vercel.app/schema/registry-item.json",
  "name": "alert",
  "type": "registry:ui",
  "registryDependencies": [
    "icon",
    "text"
  ],
  "files": [
    {
      "path": "src/registry/ui/alert.tsx",
      "content": "import React, { createContext, useContext, useMemo } from 'react';\nimport { View } from 'react-native';\nimport { StyleSheet } from 'react-native-unistyles';\n\nimport { Icon, IconProps } from '@/registry/ui/icon';\nimport { Text, TextProps } from '@/registry/ui/text';\nimport { Color } from '@/styles/tokens/colors';\n\ntype AlertVariant =\n  | 'primary'\n  | 'secondary'\n  | 'destructive'\n  | 'success'\n  | 'outline';\n\ntype AlertContextType = {\n  variant: AlertVariant;\n};\n\nconst AlertContext = createContext<AlertContextType | null>(null);\n\nconst useAlert = () => {\n  const ctx = useContext(AlertContext);\n  if (!ctx) {\n    throw new Error('useAlert must be used within a <Alert />');\n  }\n  return ctx;\n};\n\ntype AlertProps = React.ComponentProps<typeof View> & {\n  variant?: AlertVariant;\n};\n\nfunction Alert({ variant = 'primary', style, ...restProps }: AlertProps) {\n  styles.useVariants({\n    variant,\n  });\n\n  const contextValue = useMemo<AlertContextType>(\n    () => ({\n      variant,\n    }),\n    [variant],\n  );\n\n  return (\n    <AlertContext value={contextValue}>\n      <View\n        accessibilityRole=\"alert\"\n        style={[styles.alert, style]}\n        {...restProps}\n      />\n    </AlertContext>\n  );\n}\n\nfunction AlertContent({\n  style,\n  ...restProps\n}: React.ComponentProps<typeof View>) {\n  return <View style={[styles.content, style]} {...restProps} />;\n}\n\nAlert.Content = AlertContent;\n\nconst fgColorMap: Record<NonNullable<AlertProps['variant']>, Color> = {\n  primary: 'primarySubtleForeground',\n  secondary: 'secondaryForeground',\n  destructive: 'destructiveSubtleForeground',\n  success: 'successSubtleForeground',\n  outline: 'secondaryForeground',\n};\n\nfunction AlertTitle(props: TextProps) {\n  const { variant } = useAlert();\n  return <Text color={fgColorMap[variant]} variant=\"labelMd\" {...props} />;\n}\n\nAlert.Title = AlertTitle;\n\nfunction AlertDescription(props: TextProps) {\n  const { variant } = useAlert();\n  return <Text color={fgColorMap[variant]} variant=\"bodySm\" {...props} />;\n}\n\nAlert.Description = AlertDescription;\n\nfunction AlertIcon(props: IconProps) {\n  const { variant } = useAlert();\n\n  styles.useVariants({\n    variant,\n  });\n\n  return (\n    <Icon\n      color={fgColorMap[variant]}\n      size={20}\n      style={styles.icon}\n      {...props}\n    />\n  );\n}\n\nAlert.Icon = AlertIcon;\n\nconst styles = StyleSheet.create(({ colors, radius, space }) => ({\n  alert: {\n    flexDirection: 'row',\n    gap: space.lg,\n    alignItems: 'center',\n    padding: space.xl,\n    borderRadius: radius.lg,\n    borderCurve: 'continuous',\n    width: '100%',\n    variants: {\n      variant: {\n        primary: {\n          backgroundColor: colors.primarySubtle,\n        },\n        secondary: {\n          backgroundColor: colors.secondary,\n        },\n        destructive: {\n          backgroundColor: colors.destructiveSubtle,\n        },\n        success: {\n          backgroundColor: colors.successSubtle,\n        },\n        outline: {\n          borderWidth: 1,\n          borderColor: colors.border,\n        },\n      },\n    },\n  },\n  content: {\n    flex: 1,\n    display: 'flex',\n    flexDirection: 'column',\n    gap: space.xs,\n  },\n  icon: {\n    alignSelf: 'flex-start',\n    marginTop: 1,\n  },\n}));\n\nexport { Alert, useAlert };\nexport type { AlertProps };\n",
      "type": "registry:ui"
    }
  ]
}