{
  "$schema": "https://saaj-ui.vercel.app/schema/registry-item.json",
  "name": "checkbox",
  "type": "registry:ui",
  "dependencies": [
    "react-native-svg"
  ],
  "registryDependencies": [
    "icon",
    "use-controllable-state"
  ],
  "files": [
    {
      "path": "src/registry/ui/checkbox.tsx",
      "content": "import React, { createContext, useCallback, useContext, useMemo } from 'react';\nimport {\n  GestureResponderEvent,\n  Insets,\n  Pressable,\n  PressableStateCallbackType,\n  StyleProp,\n  ViewStyle,\n} from 'react-native';\nimport { StyleSheet } from 'react-native-unistyles';\nimport { useAnimatedTheme } from 'react-native-unistyles/reanimated';\nimport Animated, {\n  interpolateColor,\n  SharedValue,\n  useAnimatedProps,\n  useAnimatedStyle,\n  useSharedValue,\n  withTiming,\n} from 'react-native-reanimated';\nimport Svg, { Path } from 'react-native-svg';\n\nimport { useControllableState } from '@/registry/hooks/use-controllable-state';\n\ntype CheckboxContextType = {\n  checked: boolean;\n  disabled: boolean;\n  progress: SharedValue<number>;\n};\n\nconst CheckboxContext = createContext<CheckboxContextType | null>(null);\n\nconst useCheckbox = () => {\n  const ctx = useContext(CheckboxContext);\n  if (!ctx) {\n    throw new Error('useCheckbox must be used within a <Checkbox />');\n  }\n  return ctx;\n};\n\nconst DEFAULT_HIT_SLOP: Insets = {\n  top: 8,\n  left: 8,\n  bottom: 8,\n  right: 8,\n};\n\ntype CheckboxProps = Omit<\n  React.ComponentPropsWithRef<typeof Pressable>,\n  'style'\n> & {\n  style?:\n    | StyleProp<ViewStyle>\n    | ((\n        state: PressableStateCallbackType,\n        context: CheckboxContextType,\n      ) => StyleProp<ViewStyle>);\n  checked?: boolean;\n  defaultChecked?: boolean;\n  onCheckedChange?: (checked: boolean) => void;\n};\n\nfunction Checkbox({\n  accessibilityState,\n  children,\n  defaultChecked,\n  checked: checkedProp,\n  onCheckedChange,\n  disabled = false,\n  onPress: onPressProp,\n  style,\n  ...restProps\n}: CheckboxProps) {\n  const [checked, setChecked] = useControllableState({\n    defaultValue: defaultChecked ?? false,\n    controlledValue: checkedProp,\n    onControlledChange: onCheckedChange,\n  });\n\n  const progress = useSharedValue(checked ? 1 : 0);\n\n  const onPress = useCallback(\n    (e: GestureResponderEvent) => {\n      const newValue = !checked;\n      setChecked(newValue);\n      progress.value = withTiming(newValue ? 1 : 0, { duration: 250 });\n      onPressProp?.(e);\n    },\n    [onPressProp, checked, setChecked, progress],\n  );\n\n  const contextValue = useMemo<CheckboxContextType>(() => {\n    return {\n      checked,\n      disabled: !!disabled,\n      progress,\n    };\n  }, [checked, disabled, progress]);\n\n  return (\n    <CheckboxContext value={contextValue}>\n      <Pressable\n        accessibilityRole=\"checkbox\"\n        accessibilityState={{\n          ...accessibilityState,\n          checked,\n          disabled: !!disabled,\n        }}\n        disabled={disabled}\n        onPress={onPress}\n        style={state => [\n          styles.checkbox,\n          typeof style === 'function' ? style(state, contextValue) : style,\n        ]}\n        {...restProps}\n      >\n        {children ?? <CheckboxIndicator />}\n      </Pressable>\n    </CheckboxContext>\n  );\n}\n\ntype CheckboxStateProps = {\n  children?: React.ReactNode | ((ctx: CheckboxContextType) => React.ReactNode);\n};\n\nfunction CheckboxState({ children }: CheckboxStateProps) {\n  const ctx = useCheckbox();\n  if (typeof children === 'function') {\n    return children(ctx);\n  }\n  return children;\n}\n\nCheckbox.State = CheckboxState;\n\ntype CheckboxIndicatorProps = {\n  children?: React.ReactNode;\n};\n\nfunction CheckboxIndicator({ children }: CheckboxIndicatorProps) {\n  const { disabled, progress } = useCheckbox();\n  const animatedTheme = useAnimatedTheme();\n\n  const animatedStyle = useAnimatedStyle(() => ({\n    opacity: disabled ? 0.5 : 1,\n    backgroundColor: interpolateColor(\n      progress.value,\n      [0, 1],\n      ['transparent', animatedTheme.value.colors.primary],\n    ),\n    borderColor: interpolateColor(\n      progress.value,\n      [0, 1],\n      [animatedTheme.value.colors.border, animatedTheme.value.colors.primary],\n    ),\n  }));\n\n  return (\n    <Animated.View\n      hitSlop={DEFAULT_HIT_SLOP}\n      style={[styles.indicator, animatedStyle]}\n    >\n      {children ?? <CheckboxIcon />}\n    </Animated.View>\n  );\n}\n\nCheckbox.Indicator = CheckboxIndicator;\n\nconst AnimatedPath = Animated.createAnimatedComponent(Path);\n\nconst CHECKMARK_PATH = 'M6 12L10 16L18 8';\nconst PATH_LENGTH = 20;\n\ntype CheckboxIconProps = {\n  size?: number;\n};\n\nfunction CheckboxIcon({ size = 22 }: CheckboxIconProps) {\n  const { progress } = useCheckbox();\n  const animatedPathProps = useAnimatedProps(() => ({\n    strokeDashoffset: PATH_LENGTH * (1 - progress.value),\n  }));\n\n  return (\n    <Svg width={size} height={size} viewBox=\"0 0 24 24\" fill=\"none\">\n      <AnimatedPath\n        d={CHECKMARK_PATH}\n        stroke=\"white\"\n        strokeWidth=\"2.25\"\n        strokeLinecap=\"round\"\n        strokeLinejoin=\"round\"\n        strokeDasharray={PATH_LENGTH}\n        animatedProps={animatedPathProps}\n      />\n    </Svg>\n  );\n}\n\nCheckbox.Icon = CheckboxIcon;\n\nconst styles = StyleSheet.create(({ radius, space }) => ({\n  checkbox: {\n    flexDirection: 'row',\n    alignItems: 'center',\n    gap: space.lg,\n  },\n  indicator: {\n    justifyContent: 'center',\n    alignItems: 'center',\n    width: 22,\n    height: 22,\n    borderWidth: 1.5,\n    borderRadius: radius.xs,\n    borderCurve: 'continuous',\n  },\n}));\n\nexport { Checkbox, useCheckbox };\nexport type { CheckboxProps };\n",
      "type": "registry:ui"
    }
  ]
}