{
  "$schema": "https://saaj-ui.vercel.app/schema/registry-item.json",
  "name": "dialog",
  "type": "registry:ui",
  "registryDependencies": [
    "text",
    "use-controllable-state",
    "compose-refs"
  ],
  "files": [
    {
      "path": "src/registry/ui/dialog.tsx",
      "content": "import React, {\n  createContext,\n  useCallback,\n  useContext,\n  useId,\n  useMemo,\n  useRef,\n} from 'react';\nimport {\n  GestureResponderEvent,\n  Modal,\n  Pressable,\n  PressableProps,\n  View,\n} from 'react-native';\nimport { StyleSheet } from 'react-native-unistyles';\nimport Animated, {\n  Easing,\n  FadeIn,\n  FadeOut,\n  Keyframe,\n} from 'react-native-reanimated';\nimport { KeyboardAvoidingView } from 'react-native-keyboard-controller';\n\nimport { Text, TextProps } from '@/registry/ui/text';\nimport { useControllableState } from '@/registry/hooks/use-controllable-state';\nimport { useComposedRefs } from '@/registry/utils/compose-refs';\n\ntype DialogContextType = {\n  defaultOpen: boolean;\n  open: boolean;\n  onOpen: () => void;\n  onClose: () => void;\n  closeOnOutsidePress: boolean;\n  closeOnBackPress: boolean;\n  triggerRef: React.RefObject<View | null>;\n  titleId: string;\n};\n\nconst DialogContext = createContext<DialogContextType | null>(null);\n\nconst useDialog = () => {\n  const ctx = useContext(DialogContext);\n  if (!ctx) {\n    throw new Error('useDialog must be used within a <Dialog />');\n  }\n  return ctx;\n};\n\ntype DialogProps = {\n  children?: React.ReactNode;\n  defaultOpen?: boolean;\n  open?: boolean;\n  onOpenChange?: (open: boolean) => void;\n  /**\n   * Whether to close the dialog when pressing outside(on overlay) of it.\n   */\n  closeOnOutsidePress?: boolean;\n  /**\n   * Whether to close the dialog when pressing the back button on Android.\n   */\n  closeOnBackPress?: boolean;\n};\n\nfunction Dialog({\n  children,\n  defaultOpen = false,\n  open: openProp,\n  onOpenChange,\n  closeOnOutsidePress = true,\n  closeOnBackPress = true,\n}: DialogProps) {\n  const [open, setOpen] = useControllableState({\n    defaultValue: defaultOpen,\n    controlledValue: openProp,\n    onControlledChange: onOpenChange,\n  });\n\n  const triggerRef = useRef<View | null>(null);\n  const titleId = useId();\n\n  const onOpen = useCallback(() => {\n    setOpen(true);\n  }, [setOpen]);\n\n  const onClose = useCallback(() => {\n    setOpen(false);\n  }, [setOpen]);\n\n  const contextValue = useMemo<DialogContextType>(\n    () => ({\n      defaultOpen,\n      open,\n      onOpen,\n      onClose,\n      triggerRef,\n      titleId,\n      closeOnOutsidePress,\n      closeOnBackPress,\n    }),\n    [\n      closeOnBackPress,\n      closeOnOutsidePress,\n      defaultOpen,\n      onClose,\n      onOpen,\n      open,\n      titleId,\n    ],\n  );\n\n  return <DialogContext value={contextValue}>{children}</DialogContext>;\n}\n\ntype DialogTriggerProps<T extends React.ElementType = typeof Pressable> =\n  React.ComponentPropsWithoutRef<T> & {\n    as?: T;\n    ref?: React.Ref<View>;\n  };\n\nfunction DialogTrigger<T extends React.ElementType<PressableProps>>({\n  as,\n  ref,\n  accessibilityState,\n  disabled,\n  onPress: onPressProp,\n  ...restProps\n}: DialogTriggerProps<T>) {\n  const { open, onOpen, triggerRef } = useDialog();\n\n  const composedRefs = useComposedRefs(triggerRef, ref);\n\n  const onPress = React.useCallback(\n    (e: GestureResponderEvent) => {\n      onOpen();\n      onPressProp?.(e);\n    },\n    [onPressProp, onOpen],\n  );\n\n  const Comp = as ?? Pressable;\n\n  return (\n    <Comp\n      ref={composedRefs}\n      accessibilityRole=\"button\"\n      accessibilityState={{\n        ...accessibilityState,\n        expanded: open,\n        disabled: !!disabled,\n      }}\n      disabled={disabled}\n      onPress={onPress}\n      {...restProps}\n    />\n  );\n}\n\nDialog.Trigger = DialogTrigger;\n\nconst AnimatedPressable = Animated.createAnimatedComponent(Pressable);\n\nconst animConfig = {\n  duration: 250,\n  easing: Easing.inOut(Easing.ease),\n} as const;\n\nfunction DialogOverlay() {\n  const { onClose, closeOnOutsidePress } = useDialog();\n\n  return (\n    <AnimatedPressable\n      accessible={false}\n      accessibilityElementsHidden={true}\n      importantForAccessibility=\"no\"\n      disabled={!closeOnOutsidePress}\n      entering={FadeIn.duration(animConfig.duration).easing(animConfig.easing)}\n      exiting={FadeOut.duration(animConfig.duration).easing(animConfig.easing)}\n      onPress={onClose}\n      style={styles.overlay}\n    />\n  );\n}\n\nconst entryAnim = new Keyframe({\n  0: {\n    opacity: 0,\n    transform: [{ scale: 0.95 }],\n  },\n  100: {\n    opacity: 1,\n    transform: [{ scale: 1 }],\n    easing: animConfig.easing,\n  },\n});\n\nconst exitAnim = new Keyframe({\n  0: {\n    opacity: 1,\n    transform: [{ scale: 1 }],\n  },\n  100: {\n    opacity: 0,\n    transform: [{ scale: 0.95 }],\n    easing: animConfig.easing,\n  },\n});\n\ntype DialogContentProps = React.ComponentPropsWithRef<typeof View> & {\n  enableKeyboardAvoidingView?: boolean;\n};\n\nfunction DialogContent({\n  enableKeyboardAvoidingView = false,\n  style,\n  ...restProps\n}: DialogContentProps) {\n  const { open, closeOnBackPress, titleId, onClose } = useDialog();\n\n  const handleRequestClose = useCallback(() => {\n    if (closeOnBackPress) {\n      onClose();\n    }\n  }, [closeOnBackPress, onClose]);\n\n  if (!open) {\n    return;\n  }\n\n  return (\n    <Modal\n      visible={true}\n      transparent={true}\n      statusBarTranslucent={true}\n      navigationBarTranslucent={true}\n      animationType=\"none\"\n      accessibilityLabelledBy={titleId}\n      onRequestClose={handleRequestClose}\n    >\n      <DialogOverlay />\n      <View pointerEvents=\"box-none\" style={styles.contentContainer}>\n        <KeyboardAvoidingView\n          behavior=\"padding\"\n          keyboardVerticalOffset={24}\n          enabled={enableKeyboardAvoidingView}\n          style={styles.keyboardAvoidingView}\n        >\n          <Animated.View\n            entering={entryAnim.duration(animConfig.duration)}\n            exiting={exitAnim.duration(animConfig.duration)}\n            style={[styles.content, style]}\n            {...restProps}\n          />\n        </KeyboardAvoidingView>\n      </View>\n    </Modal>\n  );\n}\n\nDialog.Content = DialogContent;\n\nfunction DialogHeader({\n  style,\n  ...restProps\n}: React.ComponentPropsWithRef<typeof View>) {\n  return <View style={[styles.header, style]} {...restProps} />;\n}\n\nDialog.Header = DialogHeader;\n\nfunction DialogFooter({\n  style,\n  ...restProps\n}: React.ComponentPropsWithRef<typeof View>) {\n  return <View style={[styles.footer, style]} {...restProps} />;\n}\n\nDialog.Footer = DialogFooter;\n\nfunction DialogTitle(props: TextProps) {\n  const { titleId } = useDialog();\n\n  return <Text nativeID={titleId} variant=\"headlineXs\" {...props} />;\n}\n\nDialog.Title = DialogTitle;\n\nfunction DialogDescription(props: TextProps) {\n  return <Text color=\"mutedForeground\" variant=\"bodyMd\" {...props} />;\n}\n\nDialog.Description = DialogDescription;\n\ntype DialogCloseProps<T extends React.ElementType = typeof Pressable> =\n  React.ComponentPropsWithoutRef<T> & {\n    as?: T;\n    ref?: React.Ref<View>;\n  };\n\nfunction DialogClose<T extends React.ElementType<PressableProps>>({\n  as,\n  onPress: onPressProp,\n  ...restProps\n}: DialogCloseProps<T>) {\n  const { onClose } = useDialog();\n\n  const onPress = useCallback(\n    (e: GestureResponderEvent) => {\n      onClose();\n      onPressProp?.(e);\n    },\n    [onPressProp, onClose],\n  );\n\n  const Comp = as ?? Pressable;\n\n  return <Comp accessibilityRole=\"button\" onPress={onPress} {...restProps} />;\n}\n\nDialog.Close = DialogClose;\n\nconst styles = StyleSheet.create(({ colors, radius, space }, rt) => ({\n  container: {\n    flex: 1,\n    width: rt.screen.width,\n    height: rt.screen.height,\n  },\n  overlay: {\n    ...StyleSheet.absoluteFillObject,\n    backgroundColor: colors.overlay,\n  },\n  keyboardAvoidingView: {\n    width: '100%',\n  },\n  contentContainer: {\n    flex: 1,\n    width: '100%',\n    height: '100%',\n    alignItems: 'center',\n    justifyContent: 'center',\n    paddingHorizontal: space['3xl'],\n  },\n  content: {\n    maxHeight: rt.screen.height - rt.insets.top - rt.insets.bottom,\n    maxWidth: 480,\n    width: '100%',\n    gap: space.lg,\n    padding: space.xl,\n    borderRadius: radius['2xl'],\n    borderCurve: 'continuous',\n    backgroundColor: colors.dialog,\n    boxShadow: `0px 4px 24px 2px rgba(0, 0, 0, 0.1)`,\n  },\n  header: {\n    gap: space.md,\n    padding: space.md,\n  },\n  footer: {\n    flexDirection: 'row',\n    justifyContent: 'flex-end',\n    gap: space.lg,\n  },\n}));\n\nexport { Dialog, useDialog };\nexport type { DialogProps };\n",
      "type": "registry:ui"
    }
  ]
}