{
  "$schema": "https://saaj-ui.vercel.app/schema/registry-item.json",
  "name": "button",
  "type": "registry:ui",
  "registryDependencies": [
    "icon",
    "text"
  ],
  "files": [
    {
      "path": "src/registry/ui/button.tsx",
      "content": "import React, { createContext, useCallback, useContext, useMemo } from 'react';\nimport {\n  GestureResponderEvent,\n  Pressable,\n  StyleProp,\n  View,\n  ViewStyle,\n} from 'react-native';\nimport { StyleSheet, withUnistyles } from 'react-native-unistyles';\nimport Animated, {\n  AnimatedStyle,\n  Easing,\n  useAnimatedStyle,\n  useSharedValue,\n  withTiming,\n  WithTimingConfig,\n} from 'react-native-reanimated';\n\nimport { Text, TextProps } from '@/registry/ui/text';\nimport { Icon, IconProps } from '@/registry/ui/icon';\nimport { Color } from '@/styles/tokens/colors';\n\nconst AnimatedPressable = Animated.createAnimatedComponent(\n  withUnistyles(Pressable),\n);\n\ntype ButtonSize = 'xs' | 'sm' | 'md' | 'lg';\ntype ButtonVariant =\n  | 'primary'\n  | 'secondary'\n  | 'destructive'\n  | 'destructiveSubtle'\n  | 'outline'\n  | 'ghost'\n  | 'link';\n\ntype ButtonContextType = {\n  size: ButtonSize;\n  variant: ButtonVariant;\n  iconOnly: boolean;\n};\n\nconst ButtonContext = createContext<ButtonContextType | null>(null);\n\nconst useButton = () => {\n  const ctx = useContext(ButtonContext);\n  if (!ctx) {\n    throw new Error('useButton must be used within a <Button />');\n  }\n  return ctx;\n};\n\ntype ButtonProps = React.ComponentPropsWithoutRef<typeof AnimatedPressable> & {\n  // reanimated changes the type of the `key` prop on `AnimatedPressable`\n  key?: React.Key;\n  ref?: React.Ref<View>;\n  size?: ButtonSize;\n  variant?: ButtonVariant;\n  iconOnly?: boolean;\n  fill?: boolean;\n  style?: StyleProp<AnimatedStyle<StyleProp<ViewStyle>>>;\n};\n\nconst animConfig: WithTimingConfig = {\n  duration: 120,\n  easing: Easing.quad,\n};\n\nfunction Button({\n  size = 'md',\n  variant = 'primary',\n  iconOnly = false,\n  fill = false,\n  disabled,\n  style,\n  onPressIn: onPressInProp,\n  onPressOut: onPressOutProp,\n  ...restProps\n}: ButtonProps) {\n  styles.useVariants({\n    size,\n    variant,\n    fill,\n  });\n\n  const pressed = useSharedValue(false);\n\n  const onPressIn = useCallback(\n    (e: GestureResponderEvent) => {\n      pressed.value = true;\n      typeof onPressInProp === 'function' && onPressInProp(e);\n    },\n    [pressed, onPressInProp],\n  );\n\n  const onPressOut = useCallback(\n    (e: GestureResponderEvent) => {\n      pressed.value = false;\n      typeof onPressOutProp === 'function' && onPressOutProp(e);\n    },\n    [pressed, onPressOutProp],\n  );\n\n  const animatedStyles = useAnimatedStyle(() => {\n    return {\n      opacity: withTiming(\n        disabled ? 0.5 : pressed.value ? 0.95 : 1,\n        animConfig,\n      ),\n      transform: [\n        {\n          scale: withTiming(pressed.value ? 0.98 : 1, animConfig),\n        },\n      ],\n    };\n  });\n\n  const contextValue = useMemo<ButtonContextType>(() => {\n    return {\n      size,\n      variant,\n      iconOnly,\n    };\n  }, [size, variant, iconOnly]);\n\n  return (\n    <ButtonContext value={contextValue}>\n      <AnimatedPressable\n        accessibilityRole=\"button\"\n        disabled={disabled}\n        onPressIn={onPressIn}\n        onPressOut={onPressOut}\n        style={[\n          styles.button,\n          iconOnly && styles.buttonIconOnly,\n          animatedStyles,\n          style,\n        ]}\n        {...restProps}\n      />\n    </ButtonContext>\n  );\n}\n\nconst fgColorMap: Record<NonNullable<ButtonProps['variant']>, Color> = {\n  primary: 'primaryForeground',\n  secondary: 'secondaryForeground',\n  destructive: 'destructiveForeground',\n  destructiveSubtle: 'destructiveSubtleForeground',\n  outline: 'secondaryForeground',\n  ghost: 'secondaryForeground',\n  link: 'primary',\n};\nconst textVariantMap: Record<\n  NonNullable<ButtonProps['size']>,\n  NonNullable<TextProps['variant']>\n> = {\n  xs: 'labelXs',\n  sm: 'labelSm',\n  md: 'labelMd',\n  lg: 'labelLg',\n};\n\nfunction ButtonText(props: TextProps) {\n  const { size, variant } = useButton();\n\n  return (\n    <Text\n      color={fgColorMap[variant]}\n      variant={textVariantMap[size]}\n      {...props}\n    />\n  );\n}\n\nButton.Text = ButtonText;\n\nconst iconSizeMap: Record<\n  NonNullable<ButtonProps['size']>,\n  NonNullable<IconProps['size']>\n> = {\n  xs: 14,\n  sm: 16,\n  md: 18,\n  lg: 20,\n};\nconst iconOnlySizeMap: Record<\n  NonNullable<ButtonProps['size']>,\n  NonNullable<IconProps['size']>\n> = {\n  xs: 16,\n  sm: 20,\n  md: 24,\n  lg: 28,\n};\n\nfunction ButtonIcon(props: IconProps) {\n  const { size, variant, iconOnly } = useButton();\n\n  return (\n    <Icon\n      color={fgColorMap[variant]}\n      size={iconOnly ? iconOnlySizeMap[size] : iconSizeMap[size]}\n      {...props}\n    />\n  );\n}\n\nButton.Icon = ButtonIcon;\n\nconst styles = StyleSheet.create(({ colors, radius, space }) => ({\n  button: {\n    flexDirection: 'row',\n    justifyContent: 'center',\n    alignItems: 'center',\n    borderCurve: 'continuous',\n    variants: {\n      size: {\n        xs: {\n          minWidth: 28,\n          height: 28,\n          maxHeight: 28,\n          paddingHorizontal: space.md,\n          gap: space.xs,\n          borderRadius: radius.xs,\n        },\n        sm: {\n          minWidth: 36,\n          height: 36,\n          maxHeight: 36,\n          paddingHorizontal: space.lg,\n          gap: space.sm,\n          borderRadius: radius.sm,\n        },\n        md: {\n          minWidth: 48,\n          height: 48,\n          maxHeight: 48,\n          paddingHorizontal: space.xl,\n          gap: space.md,\n          borderRadius: radius.md,\n        },\n        lg: {\n          minWidth: 56,\n          height: 56,\n          maxHeight: 56,\n          paddingHorizontal: space['2xl'],\n          gap: space.md,\n          borderRadius: radius.lg,\n        },\n      },\n      variant: {\n        primary: {\n          backgroundColor: colors.primary,\n        },\n        secondary: {\n          backgroundColor: colors.secondary,\n        },\n        destructive: {\n          backgroundColor: colors.destructive,\n        },\n        destructiveSubtle: {\n          backgroundColor: colors.destructiveSubtle,\n        },\n        outline: {\n          borderWidth: 1,\n          borderColor: colors.border,\n        },\n        ghost: {},\n        link: {},\n      },\n      fill: {\n        true: {\n          width: '100%',\n          flex: 1,\n        },\n        false: {\n          width: 'auto',\n        },\n      },\n    },\n  },\n  buttonIconOnly: {\n    paddingHorizontal: 0,\n    variants: {\n      size: {\n        xs: {\n          width: 28,\n          height: 28,\n        },\n        sm: {\n          width: 36,\n          height: 36,\n        },\n        md: {\n          width: 48,\n          height: 48,\n        },\n        lg: {\n          width: 56,\n          height: 56,\n        },\n      },\n    },\n  },\n}));\n\nexport { Button, useButton };\nexport type { ButtonProps };\n",
      "type": "registry:ui"
    }
  ]
}