{
  "$schema": "https://saaj-ui.vercel.app/schema/registry-item.json",
  "name": "radio-group",
  "type": "registry:ui",
  "registryDependencies": [
    "use-controllable-state"
  ],
  "files": [
    {
      "path": "src/registry/ui/radio-group.tsx",
      "content": "import React, { createContext, useCallback, useContext, useMemo } from 'react';\nimport {\n  GestureResponderEvent,\n  Pressable,\n  PressableStateCallbackType,\n  StyleProp,\n  View,\n  ViewStyle,\n} from 'react-native';\nimport { StyleSheet } from 'react-native-unistyles';\nimport { useAnimatedTheme } from 'react-native-unistyles/reanimated';\nimport Animated, {\n  Easing,\n  useAnimatedStyle,\n  withTiming,\n} from 'react-native-reanimated';\n\nimport { useControllableState } from '@/registry/hooks/use-controllable-state';\n\ntype RadioGroupContextType = {\n  disabled?: boolean;\n  value: string;\n  onValueChange: (value: string) => void;\n};\n\nconst RadioGroupContext = createContext<RadioGroupContextType | null>(null);\n\nconst useRadioGroup = () => {\n  const ctx = useContext(RadioGroupContext);\n  if (!ctx) {\n    throw new Error('useRadioGroup must be used within a <RadioGroup />');\n  }\n  return ctx;\n};\n\ntype RadioGroupProps = React.ComponentPropsWithRef<typeof View> & {\n  defaultValue?: string;\n  value?: string;\n  onValueChange?: (value: string) => void;\n  disabled?: boolean;\n};\n\nfunction RadioGroup({\n  accessibilityState,\n  defaultValue,\n  value: valueProp,\n  onValueChange: onValueChangeProp,\n  disabled,\n  style,\n  ...restProps\n}: RadioGroupProps) {\n  const [value, onValueChange] = useControllableState({\n    defaultValue: defaultValue ?? '',\n    controlledValue: valueProp,\n    onControlledChange: onValueChangeProp,\n  });\n\n  const contextValue = useMemo<RadioGroupContextType>(\n    () => ({\n      value,\n      onValueChange,\n      disabled,\n    }),\n    [value, onValueChange, disabled],\n  );\n\n  return (\n    <RadioGroupContext value={contextValue}>\n      <View\n        accessibilityRole=\"radiogroup\"\n        accessibilityState={{\n          ...accessibilityState,\n          disabled,\n        }}\n        style={[styles.group, style]}\n        {...restProps}\n      />\n    </RadioGroupContext>\n  );\n}\n\ntype RadioGroupStateProps = {\n  children?:\n    | React.ReactNode\n    | ((ctx: RadioGroupContextType) => React.ReactNode);\n};\n\nfunction RadioGroupState({ children }: RadioGroupStateProps) {\n  const ctx = useRadioGroup();\n  if (typeof children === 'function') {\n    return children(ctx);\n  }\n  return children;\n}\n\nRadioGroup.State = RadioGroupState;\n\ntype RadioGroupItemContextType = {\n  checked: boolean;\n  disabled: boolean;\n};\n\nconst RadioGroupItemContext = createContext<RadioGroupItemContextType | null>(\n  null,\n);\n\nconst useRadioGroupItem = () => {\n  const context = useContext(RadioGroupItemContext);\n  if (!context) {\n    throw new Error(\n      'useRadioGroupItem must be used within a <RadioGroupItem />',\n    );\n  }\n  return context;\n};\n\ntype RadioGroupItemProps = Omit<\n  React.ComponentPropsWithRef<typeof Pressable>,\n  'style'\n> & {\n  style?:\n    | StyleProp<ViewStyle>\n    | ((\n        state: PressableStateCallbackType,\n        context: RadioGroupItemContextType,\n      ) => StyleProp<ViewStyle>);\n  value: string;\n};\n\nfunction RadioGroupItem({\n  accessibilityState,\n  value,\n  disabled: disabledProp,\n  style,\n  onPress: onPressProp,\n  ...restProps\n}: RadioGroupItemProps) {\n  const rootContext = useRadioGroup();\n  const checked = value === rootContext.value;\n  const disabled = rootContext.disabled ?? disabledProp ?? false;\n\n  const onPress = useCallback(\n    (e: GestureResponderEvent) => {\n      rootContext.onValueChange?.(value);\n      onPressProp?.(e);\n    },\n    [rootContext, value, onPressProp],\n  );\n\n  const contextValue = useMemo<RadioGroupItemContextType>(\n    () => ({\n      checked,\n      disabled,\n    }),\n    [checked, disabled],\n  );\n\n  return (\n    <RadioGroupItemContext value={contextValue}>\n      <Pressable\n        accessibilityRole=\"radio\"\n        accessibilityState={{ ...accessibilityState, checked, disabled }}\n        disabled={disabled}\n        onPress={onPress}\n        style={state => [\n          styles.item,\n          typeof style === 'function' ? style(state, contextValue) : style,\n        ]}\n        {...restProps}\n      />\n    </RadioGroupItemContext>\n  );\n}\n\nRadioGroup.Item = RadioGroupItem;\n\ntype RadioGroupItemStateProps = {\n  children?:\n    | React.ReactNode\n    | ((ctx: RadioGroupItemContextType) => React.ReactNode);\n};\n\nfunction RadioGroupItemState({ children }: RadioGroupItemStateProps) {\n  const ctx = useRadioGroupItem();\n  if (typeof children === 'function') {\n    return children(ctx);\n  }\n  return children;\n}\n\nRadioGroup.ItemState = RadioGroupItemState;\n\nconst animConfig = {\n  duration: 200,\n  easing: Easing.inOut(Easing.ease),\n} as const;\n\ntype RadioGroupItemIndicatorProps = React.ComponentPropsWithRef<\n  typeof Animated.View\n>;\n\nfunction RadioGroupItemIndicator({\n  style,\n  ...restProps\n}: RadioGroupItemIndicatorProps) {\n  const { checked, disabled } = useRadioGroupItem();\n\n  const theme = useAnimatedTheme();\n\n  const outerCircleStyles = useAnimatedStyle(() => {\n    return {\n      backgroundColor: disabled\n        ? theme.value.colors.muted\n        : theme.value.colors.primary,\n    };\n  });\n\n  const innerCircleStyles = useAnimatedStyle(() => {\n    return {\n      borderWidth: withTiming(checked ? 0 : 1.5, animConfig),\n      borderColor: disabled\n        ? theme.value.colors.borderSubtle\n        : theme.value.colors.border,\n      backgroundColor: theme.value.colors.background,\n      transform: [\n        {\n          scale: withTiming(checked ? 0.45 : 1, animConfig),\n        },\n      ],\n    };\n  });\n\n  return (\n    <Animated.View\n      style={[styles.indicator, outerCircleStyles, style]}\n      {...restProps}\n    >\n      <Animated.View style={[styles.indicator, innerCircleStyles]} />\n    </Animated.View>\n  );\n}\n\nRadioGroup.ItemIndicator = RadioGroupItemIndicator;\n\nconst styles = StyleSheet.create(({ space, radius }) => ({\n  group: {\n    gap: space.lg,\n  },\n  item: {\n    flexDirection: 'row',\n    alignItems: 'center',\n    alignSelf: 'flex-start',\n    gap: space.lg,\n  },\n  indicator: {\n    width: 22,\n    height: 22,\n    justifyContent: 'center',\n    alignItems: 'center',\n    borderRadius: radius.full,\n    borderCurve: 'continuous',\n  },\n}));\n\nexport { RadioGroup, useRadioGroup, useRadioGroupItem };\nexport type { RadioGroupProps };\n",
      "type": "registry:ui"
    }
  ]
}